[
  {
    "category": "armour",
    "mount": "other",
    "id": "oc_chitanium_5mm",
    "name": "OC Chitanium 5mm Plate",
    "maker": "Oklahoma Combine",
    "brand": "Chitanium",
    "hits": 12,
    "mass": 0.6,
    "volume": 0.8,
    "cost": 800,
    "description": "Light OC chitanium plate. Standard on Pegasus and Wolff freighter fits.",
    "protection": {
      "kinetic": 0.35,
      "concussive": 0.3,
      "energy": 0.15,
      "cyber": 0.0
    },
    "signature": {
      "thermal": 0.5,
      "gravitational": 0.3,
      "electromagnetic": 0.0,
      "computational": 0.0
    }
  },
  {
    "category": "armour",
    "mount": "other",
    "id": "hw_helios_chitanium_10mm",
    "name": "Helios Chitanium 10mm Plate",
    "maker": "Holt-Winters Corp",
    "brand": "Helios",
    "hits": 22,
    "mass": 1.2,
    "volume": 1.4,
    "cost": 1800,
    "description": "Heavy Helios chitanium for Silhouette and Dragon patrol variants.",
    "protection": {
      "kinetic": 0.55,
      "concussive": 0.48,
      "energy": 0.22,
      "cyber": 0.0
    },
    "signature": {
      "thermal": 0.5,
      "gravitational": 0.3,
      "electromagnetic": 0.0,
      "computational": 0.0
    }
  },
  {
    "category": "armour",
    "mount": "other",
    "id": "oc_chitanium_8mm",
    "name": "OC Chitanium 8mm Plate",
    "maker": "Oklahoma Combine",
    "brand": "Chitanium",
    "hits": 16,
    "mass": 0.9,
    "volume": 1.1,
    "cost": 1200,
    "description": "Mid-weight OC plate for escorts between courier and gunship roles.",
    "protection": {
      "kinetic": 0.45,
      "concussive": 0.38,
      "energy": 0.18,
      "cyber": 0.0
    },
    "signature": {
      "thermal": 0.5,
      "gravitational": 0.3,
      "electromagnetic": 0.0,
      "computational": 0.0
    }
  },
  {
    "category": "armour",
    "mount": "other",
    "id": "ora_bellatrix_plate",
    "name": "Bellatrix Plate Kit",
    "maker": "Orion Aerospace",
    "brand": "Bellatrix",
    "hits": 14,
    "mass": 0.8,
    "volume": 1.0,
    "cost": 1100,
    "description": "Orion aerospace plate kit for armed pickets.",
    "protection": {
      "kinetic": 0.4,
      "concussive": 0.35,
      "energy": 0.2,
      "cyber": 0.0
    },
    "signature": {
      "thermal": 0.5,
      "gravitational": 0.3,
      "electromagnetic": 0.0,
      "computational": 0.0
    }
  },
  {
    "category": "armour",
    "mount": "other",
    "id": "prv_ionique_plate",
    "name": "Ionique Composite Plate",
    "maker": "ParaRamcoVidia",
    "brand": "Ionique",
    "hits": 13,
    "mass": 0.75,
    "volume": 0.95,
    "cost": 1050,
    "description": "PRV composite plate with modest energy absorption.",
    "protection": {
      "kinetic": 0.32,
      "concussive": 0.28,
      "energy": 0.28,
      "cyber": 0.0
    },
    "signature": {
      "thermal": 0.5,
      "gravitational": 0.3,
      "electromagnetic": 0.0,
      "computational": 0.0
    }
  },
  {
    "category": "armour",
    "mount": "other",
    "id": "go_brutus_plate",
    "name": "Brutus Ablative Plate",
    "maker": "Galactic Outcomes",
    "brand": "Brutus",
    "hits": 18,
    "mass": 1.0,
    "volume": 1.2,
    "cost": 1500,
    "description": "GO ablative plate for Wolff gunship hardpoints.",
    "protection": {
      "kinetic": 0.48,
      "concussive": 0.42,
      "energy": 0.12,
      "cyber": 0.0
    },
    "signature": {
      "thermal": 0.5,
      "gravitational": 0.3,
      "electromagnetic": 0.0,
      "computational": 0.0
    }
  },
  {
    "category": "armour",
    "mount": "other",
    "id": "gi_industrial_plate",
    "name": "GI Industrial Plate",
    "maker": "General Industrial",
    "brand": "GI",
    "hits": 10,
    "mass": 0.5,
    "volume": 0.7,
    "cost": 650,
    "description": "Budget GI plate for militia conversions.",
    "protection": {
      "kinetic": 0.28,
      "concussive": 0.24,
      "energy": 0.1,
      "cyber": 0.0
    },
    "signature": {
      "thermal": 0.5,
      "gravitational": 0.3,
      "electromagnetic": 0.0,
      "computational": 0.0
    }
  },
  {
    "category": "armour",
    "mount": "other",
    "id": "atl_atlas_plate",
    "name": "Atlas Laminate Plate",
    "maker": "Atlas Concern",
    "brand": "Atlas",
    "hits": 20,
    "mass": 1.1,
    "volume": 1.3,
    "cost": 1700,
    "description": "Atlas laminate for fixed-mount patrol platforms.",
    "protection": {
      "kinetic": 0.52,
      "concussive": 0.45,
      "energy": 0.18,
      "cyber": 0.0
    },
    "signature": {
      "thermal": 0.5,
      "gravitational": 0.3,
      "electromagnetic": 0.0,
      "computational": 0.0
    }
  },
  {
    "category": "armour",
    "mount": "other",
    "id": "chi_chimera_plate",
    "name": "Chimera Flex Plate",
    "maker": "Chimera Corporation",
    "brand": "Chimera",
    "hits": 11,
    "mass": 0.55,
    "volume": 0.75,
    "cost": 720,
    "description": "Light Chimera flex plate for interceptors.",
    "protection": {
      "kinetic": 0.3,
      "concussive": 0.26,
      "energy": 0.22,
      "cyber": 0.0
    },
    "signature": {
      "thermal": 0.5,
      "gravitational": 0.3,
      "electromagnetic": 0.0,
      "computational": 0.0
    }
  },
  {
    "category": "armour",
    "mount": "other",
    "id": "frz_plate",
    "name": "FRZ Hardened Plate",
    "maker": "Four Rivers Zaibatsu",
    "brand": "FRZ",
    "hits": 15,
    "mass": 0.85,
    "volume": 1.0,
    "cost": 1150,
    "description": "FRZ hardened plate for corporate escorts.",
    "protection": {
      "kinetic": 0.42,
      "concussive": 0.36,
      "energy": 0.16,
      "cyber": 0.0
    },
    "signature": {
      "thermal": 0.5,
      "gravitational": 0.3,
      "electromagnetic": 0.0,
      "computational": 0.0
    }
  },
  {
    "category": "armour",
    "mount": "other",
    "id": "sbi_plate",
    "name": "Seven Bells Plate",
    "maker": "Seven Bells Inc",
    "brand": "Seven Bells",
    "hits": 12,
    "mass": 0.65,
    "volume": 0.85,
    "cost": 880,
    "description": "Seven Bells plate for mixed-fleet contracts.",
    "protection": {
      "kinetic": 0.34,
      "concussive": 0.3,
      "energy": 0.18,
      "cyber": 0.0
    },
    "signature": {
      "thermal": 0.5,
      "gravitational": 0.3,
      "electromagnetic": 0.0,
      "computational": 0.0
    }
  },
  {
    "category": "armour",
    "mount": "other",
    "id": "sne_snedeos_plate",
    "name": "SnedOS Hardened Plate",
    "maker": "SnedeCorp",
    "brand": "SnedOS",
    "hits": 10,
    "mass": 0.5,
    "volume": 0.7,
    "cost": 900,
    "description": "SnedOS hardened plate with modest EM shielding.",
    "protection": {
      "kinetic": 0.25,
      "concussive": 0.22,
      "energy": 0.25,
      "cyber": 0.05
    },
    "signature": {
      "thermal": 0.5,
      "gravitational": 0.3,
      "electromagnetic": 0.0,
      "computational": 0.0
    }
  }
]
