[
  {
    "id": "oc_river_md_magazine_200",
    "name": "River MD Magazine 200",
    "maker": "Oklahoma Combine",
    "brand": "River",
    "category": "ammunition",
    "mounts": [
      "other",
      "light_weapon",
      "medium_weapon",
      "heavy_weapon"
    ],
    "mass": 0.4,
    "volume": 1.0,
    "ammunition_capacity": {
      "oc_river_md_round": 200,
      "oc_river_md_heavy_round": 80
    },
    "cost": 320,
    "description": "River-line mass driver round storage.",
    "signature": {
      "thermal": 0.1,
      "gravitational": 0.08,
      "electromagnetic": 0.0,
      "computational": 0.0
    }
  },
  {
    "id": "prv_ionique_plasma_magazine_100",
    "name": "Ionique Plasma Magazine 100",
    "maker": "ParaRamcoVidia",
    "brand": "Ionique",
    "category": "ammunition",
    "mounts": [
      "other",
      "light_weapon",
      "medium_weapon",
      "heavy_weapon"
    ],
    "mass": 0.6,
    "volume": 1.2,
    "ammunition_capacity": {
      "prv_plasma_cell": 100
    },
    "cost": 480,
    "description": "Ionique plasma cell storage.",
    "signature": {
      "thermal": 0.1,
      "gravitational": 0.12,
      "electromagnetic": 0.0,
      "computational": 0.0
    }
  },
  {
    "id": "ora_bellatrix_rocket_magazine_16",
    "name": "Bellatrix Rocket Rack 16",
    "maker": "Orion Aerospace",
    "brand": "Bellatrix",
    "category": "ammunition",
    "mounts": [
      "other",
      "medium_weapon",
      "light_weapon"
    ],
    "mass": 0.9,
    "volume": 1.8,
    "ammunition_capacity": {
      "ora_rocket_he": 16,
      "go_rocket_emp": 8
    },
    "cost": 620,
    "description": "Bellatrix rocket storage with EMP slots.",
    "signature": {
      "thermal": 0.1,
      "gravitational": 0.18,
      "electromagnetic": 0.0,
      "computational": 0.0
    }
  },
  {
    "id": "go_brutus_scatter_magazine_80",
    "name": "Brutus Scatter Magazine 80",
    "maker": "Galactic Outcomes",
    "brand": "Brutus",
    "category": "ammunition",
    "mounts": [
      "other",
      "heavy_weapon",
      "medium_weapon"
    ],
    "mass": 0.8,
    "volume": 1.4,
    "ammunition_capacity": {
      "go_scatter_shell": 80
    },
    "cost": 520,
    "description": "Brutus scatter shell storage.",
    "signature": {
      "thermal": 0.1,
      "gravitational": 0.16,
      "electromagnetic": 0.0,
      "computational": 0.0
    }
  },
  {
    "id": "ora_bellatrix_missile_magazine_24",
    "name": "Bellatrix Missile Rack 24",
    "maker": "Orion Aerospace",
    "brand": "Bellatrix",
    "category": "ammunition",
    "mounts": [
      "other",
      "medium_weapon",
      "light_weapon"
    ],
    "mass": 1.0,
    "volume": 2.0,
    "ammunition_capacity": {
      "ora_missile_light": 24
    },
    "cost": 680,
    "description": "Bellatrix guided missile storage rack.",
    "signature": {
      "thermal": 0.1,
      "gravitational": 0.2,
      "electromagnetic": 0.0,
      "computational": 0.0
    }
  },
  {
    "id": "oc_river_md_light_magazine_200",
    "name": "River MD Light Magazine 200",
    "maker": "Oklahoma Combine",
    "brand": "River",
    "category": "ammunition",
    "mounts": [
      "other",
      "light_weapon",
      "medium_weapon",
      "heavy_weapon"
    ],
    "mass": 0.35,
    "volume": 0.8,
    "ammunition_capacity": {
      "oc_river_md_round": 200
    },
    "cost": 280,
    "description": "River-line storage for the light mass-driver round.",
    "signature": {
      "thermal": 0.1,
      "gravitational": 0.08,
      "electromagnetic": 0.0,
      "computational": 0.0
    }
  },
  {
    "id": "oc_river_md_light_magazine_100",
    "name": "River MD Light Magazine 100",
    "maker": "Oklahoma Combine",
    "brand": "River",
    "category": "ammunition",
    "mounts": [
      "other",
      "light_weapon",
      "medium_weapon",
      "heavy_weapon"
    ],
    "mass": 0.25,
    "volume": 0.6,
    "ammunition_capacity": {
      "oc_river_md_round": 100
    },
    "cost": 180,
    "description": "Short River-line magazine for the light mass-driver round.",
    "signature": {
      "thermal": 0.1,
      "gravitational": 0.06,
      "electromagnetic": 0.0,
      "computational": 0.0
    }
  },
  {
    "id": "go_brutus_scatter_magazine_24",
    "name": "Brutus Scatter Magazine 24",
    "maker": "Galactic Outcomes",
    "brand": "Brutus",
    "category": "ammunition",
    "mounts": [
      "other",
      "heavy_weapon",
      "medium_weapon"
    ],
    "mass": 0.4,
    "volume": 0.6,
    "ammunition_capacity": {
      "go_scatter_shell": 24
    },
    "cost": 180,
    "description": "Brutus scatter shell magazine sized for a full antimatter tank.",
    "signature": {
      "thermal": 0.1,
      "gravitational": 0.1,
      "electromagnetic": 0.0,
      "computational": 0.0
    }
  },
  {
    "id": "ora_bellatrix_he_rocket_magazine_16",
    "name": "Bellatrix HE Rocket Rack 16",
    "maker": "Orion Aerospace",
    "brand": "Bellatrix",
    "category": "ammunition",
    "mounts": [
      "other",
      "medium_weapon",
      "light_weapon"
    ],
    "mass": 0.7,
    "volume": 1.4,
    "ammunition_capacity": {
      "ora_rocket_he": 16
    },
    "cost": 520,
    "description": "Bellatrix storage for high-explosive rockets.",
    "signature": {
      "thermal": 0.1,
      "gravitational": 0.16,
      "electromagnetic": 0.0,
      "computational": 0.0
    }
  },
  {
    "id": "ora_bellatrix_he_rocket_magazine_3",
    "name": "Bellatrix HE Rocket Rack 3",
    "maker": "Orion Aerospace",
    "brand": "Bellatrix",
    "category": "ammunition",
    "mounts": [
      "other",
      "medium_weapon",
      "light_weapon"
    ],
    "mass": 0.35,
    "volume": 0.6,
    "ammunition_capacity": {
      "ora_rocket_he": 3
    },
    "cost": 180,
    "description": "Short Bellatrix rack for a fuelled freighter.",
    "signature": {
      "thermal": 0.1,
      "gravitational": 0.08,
      "electromagnetic": 0.0,
      "computational": 0.0
    }
  },
  {
    "id": "prv_ionique_plasma_magazine_50",
    "name": "Ionique Plasma Magazine 50",
    "maker": "ParaRamcoVidia",
    "brand": "Ionique",
    "category": "ammunition",
    "mounts": [
      "other",
      "light_weapon",
      "medium_weapon",
      "heavy_weapon"
    ],
    "mass": 0.4,
    "volume": 0.8,
    "ammunition_capacity": {
      "prv_plasma_cell": 50
    },
    "cost": 280,
    "description": "Smaller Ionique plasma cell magazine.",
    "signature": {
      "thermal": 0.1,
      "gravitational": 0.08,
      "electromagnetic": 0.0,
      "computational": 0.0
    }
  }
]
