[
  {
    "category": "cyber_defence",
    "mount": "system",
    "mass": 0.6,
    "volume": 0.5,
    "power_demand": 2.0,
    "compute_demand": 4.0,
    "id": "sne_snedeos_cyberwall",
    "name": "SnedOS Cyberwall",
    "maker": "SnedeCorp",
    "brand": "SnedOS",
    "protection": {
      "cyber": 0.4
    },
    "cost": 3200,
    "description": "Top-tier SnedOS cyber defence. Trades compute for resilience.",
    "signature": {
      "thermal": 0.3,
      "gravitational": 0.1,
      "electromagnetic": 1.5,
      "computational": 2.0
    }
  },
  {
    "category": "cyber_defence",
    "mount": "system",
    "mass": 0.6,
    "volume": 0.5,
    "power_demand": 2.0,
    "compute_demand": 4.0,
    "id": "sne_snedeos_cipher_ring",
    "name": "SnedOS Cipher Ring",
    "maker": "SnedeCorp",
    "brand": "SnedOS",
    "protection": {
      "cyber": 0.28
    },
    "cost": 2400,
    "description": "Mid-tier SnedOS cyber defence for corporate escorts.",
    "signature": {
      "thermal": 0.3,
      "gravitational": 0.1,
      "electromagnetic": 1.5,
      "computational": 2.0
    }
  },
  {
    "category": "cyber_defence",
    "mount": "system",
    "mass": 0.6,
    "volume": 0.5,
    "power_demand": 2.0,
    "compute_demand": 4.0,
    "id": "prv_ionique_compute_guard",
    "name": "PRV Compute Guard",
    "maker": "ParaRamcoVidia",
    "brand": "Ionique",
    "protection": {
      "cyber": 0.3
    },
    "cost": 2600,
    "description": "PRV compute guard for mixed-energy fleets.",
    "signature": {
      "thermal": 0.3,
      "gravitational": 0.1,
      "electromagnetic": 1.5,
      "computational": 2.0
    }
  },
  {
    "category": "cyber_defence",
    "mount": "system",
    "mass": 0.6,
    "volume": 0.5,
    "power_demand": 2.0,
    "compute_demand": 4.0,
    "id": "chi_chimera_firewall",
    "name": "Chimera Firewall",
    "maker": "Chimera Corporation",
    "brand": "Chimera",
    "protection": {
      "cyber": 0.35
    },
    "cost": 2800,
    "description": "Chimera firewall for interceptors running hot software loads.",
    "signature": {
      "thermal": 0.3,
      "gravitational": 0.1,
      "electromagnetic": 1.5,
      "computational": 2.0
    }
  }
]
