[
  {
    "category": "point_defence",
    "mount": "other",
    "mass": 0.8,
    "volume": 0.6,
    "power_demand": 3.0,
    "id": "hw_helios_guard_pd",
    "name": "Helios Guard PD",
    "maker": "Holt-Winters Corp",
    "brand": "Helios",
    "intercept_chance": 0.32,
    "cost": 2100,
    "description": "Helios close-in point defence turret.",
    "signature": {
      "thermal": 0.8,
      "gravitational": 0.1,
      "electromagnetic": 2.0,
      "computational": 0.3
    }
  },
  {
    "category": "point_defence",
    "mount": "other",
    "mass": 0.8,
    "volume": 0.6,
    "power_demand": 3.0,
    "id": "hw_helios_sentinel_pd",
    "name": "Helios Sentinel PD",
    "maker": "Holt-Winters Corp",
    "brand": "Helios",
    "intercept_chance": 0.26,
    "cost": 1800,
    "description": "Efficient Helios PD grid for escorts on a power budget.",
    "signature": {
      "thermal": 0.8,
      "gravitational": 0.1,
      "electromagnetic": 2.0,
      "computational": 0.3
    }
  },
  {
    "category": "point_defence",
    "mount": "other",
    "mass": 0.8,
    "volume": 0.6,
    "power_demand": 3.0,
    "id": "oc_river_pd",
    "name": "River Sentinel PD",
    "maker": "Oklahoma Combine",
    "brand": "River",
    "intercept_chance": 0.28,
    "cost": 1700,
    "description": "OC point defence for freighter escorts.",
    "signature": {
      "thermal": 0.8,
      "gravitational": 0.1,
      "electromagnetic": 2.0,
      "computational": 0.3
    }
  },
  {
    "category": "point_defence",
    "mount": "other",
    "mass": 0.8,
    "volume": 0.6,
    "power_demand": 3.0,
    "id": "ora_bellatrix_pd",
    "name": "Bellatrix PD Array",
    "maker": "Orion Aerospace",
    "brand": "Bellatrix",
    "intercept_chance": 0.25,
    "cost": 1600,
    "description": "Bellatrix intercept grid for missile-heavy lanes.",
    "signature": {
      "thermal": 0.8,
      "gravitational": 0.1,
      "electromagnetic": 2.0,
      "computational": 0.3
    }
  },
  {
    "category": "point_defence",
    "mount": "other",
    "mass": 0.8,
    "volume": 0.6,
    "power_demand": 3.0,
    "id": "ora_bellatrix_pd_heavy",
    "name": "Bellatrix Heavy PD",
    "maker": "Orion Aerospace",
    "brand": "Bellatrix",
    "intercept_chance": 0.34,
    "cost": 2200,
    "description": "Heavy Bellatrix PD for dedicated picket hulls.",
    "signature": {
      "thermal": 0.8,
      "gravitational": 0.1,
      "electromagnetic": 2.0,
      "computational": 0.3
    }
  },
  {
    "category": "point_defence",
    "mount": "other",
    "mass": 0.8,
    "volume": 0.6,
    "power_demand": 3.0,
    "id": "go_brutus_pd",
    "name": "Brutus PD Turret",
    "maker": "Galactic Outcomes",
    "brand": "Brutus",
    "intercept_chance": 0.3,
    "cost": 1900,
    "description": "GO point defence for gunship hardpoints.",
    "signature": {
      "thermal": 0.8,
      "gravitational": 0.1,
      "electromagnetic": 2.0,
      "computational": 0.3
    }
  }
]
