[
  {
    "category": "shield",
    "mount": "other",
    "mass": 1.0,
    "volume": 1.5,
    "regen": 3.0,
    "id": "hw_helios_deflector",
    "name": "Helios Deflector Shield",
    "maker": "Holt-Winters Corp",
    "brand": "Helios",
    "shield_type": "deflector",
    "shield_capacity": 40,
    "protection": {
      "kinetic": 0.75,
      "concussive": 0.7,
      "energy": 0.15,
      "cyber": 0.0
    },
    "power_demand": 8.0,
    "cost": 3200,
    "description": "General-purpose Helios deflector fitted to charter Pegasus and Wolff Gladius.",
    "signature": {
      "thermal": 3.9,
      "gravitational": 0.2,
      "electromagnetic": 6.0,
      "computational": 0.5
    }
  },
  {
    "category": "shield",
    "mount": "other",
    "mass": 1.0,
    "volume": 1.5,
    "regen": 3.0,
    "id": "hw_helios_bulwark_deflector",
    "name": "Helios Bulwark Deflector",
    "maker": "Holt-Winters Corp",
    "brand": "Helios",
    "shield_type": "deflector",
    "shield_capacity": 28,
    "protection": {
      "kinetic": 0.82,
      "concussive": 0.78,
      "energy": 0.08,
      "cyber": 0.0
    },
    "power_demand": 6.0,
    "cost": 2400,
    "description": "Kinetic-specialist Helios deflector for escorts that expect mass driver fire.",
    "signature": {
      "thermal": 3.9,
      "gravitational": 0.2,
      "electromagnetic": 6.0,
      "computational": 0.5
    }
  },
  {
    "category": "shield",
    "mount": "other",
    "mass": 1.0,
    "volume": 1.5,
    "regen": 3.0,
    "id": "hw_helios_energy_shield",
    "name": "Helios Energy Shield",
    "maker": "Holt-Winters Corp",
    "brand": "Helios",
    "shield_type": "energy",
    "shield_capacity": 35,
    "protection": {
      "kinetic": 0.1,
      "concussive": 0.25,
      "energy": 0.8,
      "cyber": 0.0
    },
    "power_demand": 10.0,
    "cost": 3600,
    "description": "Helios energy shield for laser-heavy engagement zones.",
    "signature": {
      "thermal": 3.9,
      "gravitational": 0.2,
      "electromagnetic": 6.0,
      "computational": 0.5
    }
  },
  {
    "category": "shield",
    "mount": "other",
    "mass": 1.0,
    "volume": 1.5,
    "regen": 3.0,
    "id": "oc_river_deflector",
    "name": "River Deflector Shield",
    "maker": "Oklahoma Combine",
    "brand": "River",
    "shield_type": "deflector",
    "shield_capacity": 30,
    "protection": {
      "kinetic": 0.65,
      "concussive": 0.6,
      "energy": 0.1,
      "cyber": 0.0
    },
    "power_demand": 6.0,
    "cost": 2600,
    "description": "Rugged OC deflector for freighter escorts.",
    "signature": {
      "thermal": 3.9,
      "gravitational": 0.2,
      "electromagnetic": 6.0,
      "computational": 0.5
    }
  },
  {
    "category": "shield",
    "mount": "other",
    "mass": 1.0,
    "volume": 1.5,
    "regen": 3.0,
    "id": "prv_ionique_energy_shield",
    "name": "Ionique Energy Shield",
    "maker": "ParaRamcoVidia",
    "brand": "Ionique",
    "shield_type": "energy",
    "shield_capacity": 32,
    "protection": {
      "kinetic": 0.08,
      "concussive": 0.2,
      "energy": 0.75,
      "cyber": 0.0
    },
    "power_demand": 9.0,
    "cost": 3400,
    "description": "PRV energy shield tuned for plasma and laser fire.",
    "signature": {
      "thermal": 3.9,
      "gravitational": 0.2,
      "electromagnetic": 6.0,
      "computational": 0.5
    }
  },
  {
    "category": "shield",
    "mount": "other",
    "mass": 1.0,
    "volume": 1.5,
    "regen": 3.0,
    "id": "ora_bellatrix_aegis",
    "name": "Bellatrix Aegis Shield",
    "maker": "Orion Aerospace",
    "brand": "Bellatrix",
    "shield_type": "deflector",
    "shield_capacity": 32,
    "protection": {
      "kinetic": 0.55,
      "concussive": 0.5,
      "energy": 0.35,
      "cyber": 0.1
    },
    "power_demand": 7.0,
    "cost": 3000,
    "description": "Mixed Bellatrix shield for multi-threat patrol craft.",
    "signature": {
      "thermal": 3.9,
      "gravitational": 0.2,
      "electromagnetic": 6.0,
      "computational": 0.5
    }
  },
  {
    "category": "shield",
    "mount": "other",
    "mass": 1.0,
    "volume": 1.5,
    "regen": 3.0,
    "id": "sne_snedeos_electronic_shield",
    "name": "SnedOS Electronic Shield",
    "maker": "SnedeCorp",
    "brand": "SnedOS",
    "shield_type": "electronic",
    "shield_capacity": 20,
    "protection": {
      "kinetic": 0.0,
      "concussive": 0.0,
      "energy": 0.2,
      "cyber": 0.7
    },
    "power_demand": 4.0,
    "cost": 2800,
    "description": "SnedOS electronic shield for cyber-heavy defence.",
    "signature": {
      "thermal": 3.9,
      "gravitational": 0.2,
      "electromagnetic": 6.0,
      "computational": 0.5
    }
  },
  {
    "category": "shield",
    "mount": "other",
    "mass": 1.0,
    "volume": 1.5,
    "regen": 3.0,
    "id": "sne_snedeos_lattice_shield",
    "name": "SnedOS Lattice Shield",
    "maker": "SnedeCorp",
    "brand": "SnedOS",
    "shield_type": "electronic",
    "shield_capacity": 24,
    "protection": {
      "kinetic": 0.0,
      "concussive": 0.0,
      "energy": 0.25,
      "cyber": 0.78
    },
    "power_demand": 5.0,
    "cost": 3400,
    "description": "Heavier SnedOS lattice for dedicated EW platforms.",
    "signature": {
      "thermal": 3.9,
      "gravitational": 0.2,
      "electromagnetic": 6.0,
      "computational": 0.5
    }
  },
  {
    "category": "shield",
    "mount": "other",
    "mass": 1.0,
    "volume": 1.5,
    "regen": 3.0,
    "id": "go_brutus_deflector",
    "name": "Brutus Deflector Shield",
    "maker": "Galactic Outcomes",
    "brand": "Brutus",
    "shield_type": "deflector",
    "shield_capacity": 25,
    "protection": {
      "kinetic": 0.55,
      "concussive": 0.5,
      "energy": 0.1,
      "cyber": 0.0
    },
    "power_demand": 6.0,
    "cost": 2500,
    "description": "GO deflector for gunship hardpoints.",
    "signature": {
      "thermal": 3.9,
      "gravitational": 0.2,
      "electromagnetic": 6.0,
      "computational": 0.5
    }
  },
  {
    "category": "shield",
    "mount": "other",
    "mass": 1.0,
    "volume": 1.5,
    "regen": 3.0,
    "id": "frz_deflector_shield",
    "name": "FRZ Deflector Shield",
    "maker": "Four Rivers Zaibatsu",
    "brand": "FRZ",
    "shield_type": "deflector",
    "shield_capacity": 26,
    "protection": {
      "kinetic": 0.58,
      "concussive": 0.52,
      "energy": 0.11,
      "cyber": 0.0
    },
    "power_demand": 6.0,
    "cost": 2640,
    "description": "FRZ deflector line for budget militia contracts.",
    "signature": {
      "thermal": 3.9,
      "gravitational": 0.2,
      "electromagnetic": 6.0,
      "computational": 0.5
    }
  }
]
